{
  "$schema": "https://json-schema.org/draft/2020-12/schema",
  "$id": "https://easysubway.app/contracts/mobile/generic-mobile-consumer-bundle.schema.json",
  "type": "object",
  "additionalProperties": false,
  "required": ["schemaVersion", "artifactKind", "component", "bundleVersion", "producer", "resources", "resourceInventorySha256", "payloadSha256"],
  "properties": {
    "schemaVersion": { "const": 1 },
    "artifactKind": { "const": "generic-mobile-consumer-bundle" },
    "component": { "const": "mobile" },
    "bundleVersion": { "const": "1.0.0" },
    "producer": { "type": "object", "additionalProperties": false, "required": ["repository", "gitSha"], "properties": { "repository": { "const": "AquilaXk/easysubway" }, "gitSha": { "const": "604a2ae525cc20b3bdcd3cbe2e22f93de19fefc3" } } },
    "resources": { "type": "array", "minItems": 2, "maxItems": 2, "prefixItems": [
      { "type": "object", "additionalProperties": false, "required": ["resourceId", "mediaType", "schemaVersion", "ownerRepository", "ownerIssue", "sourcePath", "contentBase64", "rawSha256", "sizeBytes"], "properties": { "resourceId": { "const": "errors/error-codes.json" }, "mediaType": { "const": "application/json" }, "schemaVersion": { "const": null }, "ownerRepository": { "const": "AquilaXk/easysubway" }, "ownerIssue": { "const": 2747 }, "sourcePath": { "const": "contracts/error-codes.json" }, "contentBase64": { "const": "WwogIHsKICAgICJjb2RlIjogIklOVkFMSURfUkVRVUVTVCIsCiAgICAiY2F0ZWdvcnkiOiAiVVNFUiIsCiAgICAiaHR0cFN0YXR1cyI6IDQwMCwKICAgICJrb01lc3NhZ2VLZXkiOiAiZXJyb3IuaW52YWxpZC1yZXF1ZXN0IgogIH0sCiAgewogICAgImNvZGUiOiAiUkVTT1VSQ0VfTk9UX0ZPVU5EIiwKICAgICJjYXRlZ29yeSI6ICJVU0VSIiwKICAgICJodHRwU3RhdHVzIjogNDA0LAogICAgImtvTWVzc2FnZUtleSI6ICJlcnJvci5yZXNvdXJjZS1ub3QtZm91bmQiCiAgfSwKICB7CiAgICAiY29kZSI6ICJDT05GTElDVCIsCiAgICAiY2F0ZWdvcnkiOiAiVVNFUiIsCiAgICAiaHR0cFN0YXR1cyI6IDQwOSwKICAgICJrb01lc3NhZ2VLZXkiOiAiZXJyb3IuY29uZmxpY3QiCiAgfSwKICB7CiAgICAiY29kZSI6ICJVTlJFQURBQkxFX0JPRFkiLAogICAgImNhdGVnb3J5IjogIlVTRVIiLAogICAgImh0dHBTdGF0dXMiOiA0MDAsCiAgICAia29NZXNzYWdlS2V5IjogImVycm9yLnVucmVhZGFibGUtYm9keSIKICB9LAogIHsKICAgICJjb2RlIjogIklOVEVSTkFMX0VSUk9SIiwKICAgICJjYXRlZ29yeSI6ICJTWVNURU0iLAogICAgImh0dHBTdGF0dXMiOiA1MDAsCiAgICAia29NZXNzYWdlS2V5IjogImVycm9yLmludGVybmFsLWVycm9yIgogIH0sCiAgewogICAgImNvZGUiOiAiUk9VVEVfU0VTU0lPTl9BVFRFU1RBVElPTl9SRUpFQ1RFRCIsCiAgICAiY2F0ZWdvcnkiOiAiVVNFUiIsCiAgICAiaHR0cFN0YXR1cyI6IDQwMywKICAgICJrb01lc3NhZ2VLZXkiOiAiZXJyb3Iucm91dGUtc2Vzc2lvbi1hdHRlc3RhdGlvbi1yZWplY3RlZCIKICB9LAogIHsKICAgICJjb2RlIjogIlJPVVRFX1NFU1NJT05fQVRURVNUQVRJT05fVU5BVkFJTEFCTEUiLAogICAgImNhdGVnb3J5IjogIkRFUEVOREVOQ1kiLAogICAgImh0dHBTdGF0dXMiOiA1MDMsCiAgICAia29NZXNzYWdlS2V5IjogImVycm9yLnJvdXRlLXNlc3Npb24tYXR0ZXN0YXRpb24tdW5hdmFpbGFibGUiCiAgfSwKICB7CiAgICAiY29kZSI6ICJJVFhfVElNRVRBQkxFX1VOQVZBSUxBQkxFIiwKICAgICJjYXRlZ29yeSI6ICJERVBFTkRFTkNZIiwKICAgICJodHRwU3RhdHVzIjogNTAzLAogICAgImtvTWVzc2FnZUtleSI6ICJlcnJvci5pdHgtdGltZXRhYmxlLXVuYXZhaWxhYmxlIgogIH0sCiAgewogICAgImNvZGUiOiAiUk9VVEVfU0NPUEVfSU5WQUxJRCIsCiAgICAiY2F0ZWdvcnkiOiAiVVNFUiIsCiAgICAiaHR0cFN0YXR1cyI6IDQyMiwKICAgICJrb01lc3NhZ2VLZXkiOiAiZXJyb3Iucm91dGUtc2NvcGUtaW52YWxpZCIKICB9LAogIHsKICAgICJjb2RlIjogIlJPVVRFX1NFU1NJT05fUkVRVUlSRUQiLAogICAgImNhdGVnb3J5IjogIlVTRVIiLAogICAgImh0dHBTdGF0dXMiOiA0MDEsCiAgICAia29NZXNzYWdlS2V5IjogImVycm9yLnJvdXRlLXNlc3Npb24tcmVxdWlyZWQiCiAgfSwKICB7CiAgICAiY29kZSI6ICJST1VURV9SQVRFX0xJTUlURUQiLAogICAgImNhdGVnb3J5IjogIlVTRVIiLAogICAgImh0dHBTdGF0dXMiOiA0MjksCiAgICAia29NZXNzYWdlS2V5IjogImVycm9yLnJvdXRlLXJhdGUtbGltaXRlZCIKICB9LAogIHsKICAgICJjb2RlIjogIlJPVVRFX09SSUdJTl9GT1JCSURERU4iLAogICAgImNhdGVnb3J5IjogIlVTRVIiLAogICAgImh0dHBTdGF0dXMiOiA0MDMsCiAgICAia29NZXNzYWdlS2V5IjogImVycm9yLnJvdXRlLW9yaWdpbi1mb3JiaWRkZW4iCiAgfQpdCg==" }, "rawSha256": { "const": "7527a60514a7000ae8df0c958516a856dfdc288b6e085e4efbde9e3ce61d4bf9" }, "sizeBytes": { "const": 1723 } } },
      { "type": "object", "additionalProperties": false, "required": ["resourceId", "mediaType", "schemaVersion", "ownerRepository", "ownerIssue", "sourcePath", "contentBase64", "rawSha256", "sizeBytes"], "properties": { "resourceId": { "const": "product/mobility-profile-policy.json" }, "mediaType": { "const": "application/json" }, "schemaVersion": { "const": 1 }, "ownerRepository": { "const": "AquilaXk/easysubway" }, "ownerIssue": { "const": 2747 }, "sourcePath": { "const": "release/product-gates/mobility-profile-policy.json" }, "contentBase64": { "const": "ewogICJzY2hlbWFWZXJzaW9uIjogMSwKICAiYXJ0aWZhY3RLaW5kIjogIm1vYmlsaXR5LXByb2ZpbGUtcG9saWN5IiwKICAiYW5jaG9yV2Fsa1NwZWVkTXBzIjogMS4yLAogICJwcmVzZXRzIjogewogICAgIlNUQU5EQVJEIjogeyAic3BlZWRGYWN0b3IiOiAxLjAsICJmYWNpbGl0eUNvbnN0cmFpbnQiOiAiTk9ORSIgfSwKICAgICJTTE9XIjogeyAic3BlZWRGYWN0b3IiOiAxLjM1LCAiZmFjaWxpdHlDb25zdHJhaW50IjogIk5PTkUiIH0sCiAgICAiTk9fU1RBSVJTIjogeyAic3BlZWRGYWN0b3IiOiAxLjIsICJmYWNpbGl0eUNvbnN0cmFpbnQiOiAiTk9fU1RBSVJTIiB9LAogICAgIlNURVBfRlJFRSI6IHsgInNwZWVkRmFjdG9yIjogMS4wLCAiZmFjaWxpdHlDb25zdHJhaW50IjogIkVMRVZBVE9SX09OTFkiLCAiZWxldmF0b3JXYWl0U2Vjb25kcyI6IDYwIH0KICB9LAogICJtb2JpbGl0eVR5cGVNYXBwaW5nIjogewogICAgIlNFTklPUiI6ICJTTE9XIiwKICAgICJQUkVHTkFOVCI6ICJTTE9XIiwKICAgICJURU1QT1JBUllfSU5KVVJZIjogIlNMT1ciLAogICAgIkxVR0dBR0UiOiAiTk9fU1RBSVJTIiwKICAgICJTVFJPTExFUiI6ICJTVEVQX0ZSRUUiLAogICAgIldIRUVMQ0hBSVIiOiAiU1RFUF9GUkVFIgogIH0KfQo=" }, "rawSha256": { "const": "5a63a03ff9ec9b61e0366d947251ee9294ebd48777b28b1ad6e2bdbe2d3fcc50" }, "sizeBytes": { "const": 635 } } }
    ], "items": false },
    "resourceInventorySha256": { "const": "b5b40b2585af7ac6255426018e30f785e28df80f1fcbac56d9d7089b332cdef9" },
    "payloadSha256": { "const": "d355c6c40814faad293c200ddd72a2cc019005bef2e5e608970ae8e4837a1b3c" }
  }
}
